{
  "schemaVersion": 1,
  "partitionId": "part:hub-external-context",
  "lineageId": "lin:hub-external-context",
  "parentLineageId": null,
  "snapshotId": "snap:hub-external-context",
  "snapshotFingerprint": "1a682c9f1b3a8164de14ac722661af3bd22601eee558d381943ea3e50816c31c",
  "regime": "A",
  "algorithm": "fixture-baseline",
  "algorithmVersion": "v1",
  "configFingerprint": "f89540654fb35ebbd7c820ba6e9e1b557d98a50ee562deca527add9ba4d50e61",
  "seed": "none",
  "communities": [
    {
      "lineageId": "lin:hub-left",
      "parentContentIds": [],
      "memberIds": [
        "1c8c2893ed9b6bb1f299e0f3878518fbe1df27db1df21c5043699d1728d385bb:0x1100",
        "1c8c2893ed9b6bb1f299e0f3878518fbe1df27db1df21c5043699d1728d385bb:0x1200"
      ],
      "kernelIds": [
        "1c8c2893ed9b6bb1f299e0f3878518fbe1df27db1df21c5043699d1728d385bb:0x1100"
      ],
      "externalContextIds": [
        "1c8c2893ed9b6bb1f299e0f3878518fbe1df27db1df21c5043699d1728d385bb:0x1000"
      ],
      "conductance": {
        "known": false,
        "value": null
      },
      "contentId": "171f8fa6fbc563ca376c91b239a78c494027bb260370826de5f023b583fff30d"
    },
    {
      "lineageId": "lin:hub-right",
      "parentContentIds": [],
      "memberIds": [
        "1c8c2893ed9b6bb1f299e0f3878518fbe1df27db1df21c5043699d1728d385bb:0x1300",
        "1c8c2893ed9b6bb1f299e0f3878518fbe1df27db1df21c5043699d1728d385bb:0x1400"
      ],
      "kernelIds": [
        "1c8c2893ed9b6bb1f299e0f3878518fbe1df27db1df21c5043699d1728d385bb:0x1300"
      ],
      "externalContextIds": [
        "1c8c2893ed9b6bb1f299e0f3878518fbe1df27db1df21c5043699d1728d385bb:0x1000"
      ],
      "conductance": {
        "known": false,
        "value": null
      },
      "contentId": "fc8c3437577d8a5a39a7cb89b1a977de3f09440828d71d88e7fce0aef2487ff7"
    }
  ],
  "modularity": {
    "known": false,
    "value": null
  },
  "maturity": "structural",
  "adopted": false
}
